"","newstitle1","newscategory1"
"1","코로나에 일자리 잃었는데.. 관광업계 실직자 방역요원 모집에 뿔난 업계","경제"
"2","현대차 반도체 최적배분해 공급 확대..정의선 사내이사 재선임","경제"
"3","민주, '검수완박' 드라이브..새 정부 출범 앞두고 강대강 대치","정치"
"4","황호진 전북교육감 후보 자율성 보장된 공립 대안학교 설치","정치"
"5","인수위 부정부패 셀프 은폐 시도인가..'檢 공약 반대' 맹비난","정치"
"6","'다중채무·저소득·저신용' 비중 큰 2030.. 연체율도 증가","경제"
"7","靑회동 지연에 文 답답하다..尹, 다른이 말듣지 말고 직접 판단해야","정치"
"8","게임규제 때문에.. 中텐센트, 10년새 가장 적은 폭 늘어난 순익","경제"
"9","박근혜, 네 문장 퇴원 인사 중 두 차례 많이 회복.. 현충원 들러 사저로","사회"
"10","전학한 학폭 가해자, 졸업 뒤 2년간 학생부 못 지운다","사회"
"11","인수위-박범계 충돌..수사지휘권 폐지·검찰 예산 독립이 뇌관","사회"
"12","2035년 내연기관차 퇴출 공약..산업부, 尹 인수위에 도입 연기 건의","경제"
"13","에어버스 신기종도 잇따른 결함.. 새 비행기, 헌 비행기보다 못하다?[이원주의 날飛]","사회"
"14","미중, 한국·대만 반도체 인력 유치전 벌일 것","국제"
"15","러, 美 외교관 대거 '맞불' 추방 결정","국제"
"16","용인시, 7월부터 2개월간 지능형교통체계 안전 점검","사회"
"17","광주교육청 부교육감, 1년마다 관사 매트리스·주방용품 교체","사회"
"18","中 우크라 사태로 에너지 위기 고조되자 원전 2배 늘린다","국제"
"19","주미 中대사관 미중 우크라 사태 관련 협력할 수 있어","국제"
"20","송유관 잠근 러시아, 보복 시작됐나?..'공포'에 뛰는 정유주","경제"
